{"$id":"naya.activation.engagement_receipt.v1","$schema":"http://json-schema.org/draft-07/schema#","additionalProperties":false,"description":"Assignment-level activation receipt. One per assignment_ref. Proves the seat engaged with the Operating Law FOR THIS task, in its own words. Composes with (does not replace) NAYA-ACTIVATION/ACTIVATION-RECEIPT-TEMPLATE.json, which is session-level.","properties":{"assignment_ref":{"description":"The exact assignment this receipt is bound to (dispatch ID, issue/PR reference, or brief hash). One receipt per assignment_ref; not transferable.","minLength":1,"type":"string"},"mission_objective_own_words":{"description":"The current mission objective stated fresh, in the seat's own words (2-4 sentences). Must NOT be identical to any canned mission string and must NOT be copied from the brief or a prior receipt.","minLength":40,"type":"string"},"operating_law_ref":{"description":"Optional: ref of the Operating Law the seat loaded (e.g. 'naya4/operating-law-v1'). Recommended for audit trails.","type":"string"},"proof_standard":{"description":"What 'done and verified' looks like for THIS task, concretely: the named evidence (file, test, scorecard, screenshot, ref) the lane's proof bar requires. No named evidence = not a proof standard.","minLength":40,"type":"string"},"relevant_domains":{"description":"Exactly 3 distinct Operating Law domains most relevant to THIS assignment, each with its task-specific reasoning.","items":{"additionalProperties":false,"properties":{"domain":{"description":"One of the 8 Operating Law domains (BRAIN/01-GOVERNANCE/0008-OPERATING-LAW-V1.md).","enum":["decision","communication","execution","learning","authority","constitution","design","code"],"type":"string"},"why_this_task":{"description":"Why THIS domain for THIS task, in the seat's own words. MUST reference content-bearing terms from the actual assignment text (enforced by validate_receipt.py keyword-overlap check). Template the format, never the content.","minLength":40,"type":"string"}},"required":["domain","why_this_task"],"type":"object"},"maxItems":3,"minItems":3,"type":"array"},"schema":{"const":"naya.activation.engagement_receipt.v1","description":"Schema identifier. Must match exactly.","type":"string"},"seat":{"description":"Seat identity, e.g. 'naya-3'. Must match the seat that performed Layer 1 boot.","minLength":1,"type":"string"},"timestamp":{"description":"ISO-8601 timestamp of receipt emission, e.g. '2026-10-09T18:30:00-07:00'. Must be parseable; garbage timestamps fail closed.","format":"date-time","type":"string"}},"required":["schema","seat","timestamp","assignment_ref","mission_objective_own_words","relevant_domains","proof_standard"],"title":"Naya Activation Protocol Layer 2 — Engagement Receipt","type":"object"}